<?xml version="1.0" encoding="UTF-8" ?>
<instrumenti_placanja xmlns="http://www.example.org/instrumenti_placanja" xmlns:xsi="http://www.w3.org/2001/XMLSchema-instance" xsi:schemaLocation="http://www.example.org/instrumenti_placanja instrumenti_placanja.xsd ">
	<instrument_placanja xsi:type="NalogZaUplatu">
		<naziv_duznika>Jovo Jovic</naziv_duznika>
		<naziv_povjerioca>Jovo Jovic</naziv_povjerioca>
		<svrha_placanja>Uplata na personalni racun</svrha_placanja>
		<datum_prijema>2016-06-01</datum_prijema>
		<sifra_placanja>189</sifra_placanja>
		<valuta>RSD</valuta>
		<iznos>20000.00</iznos>
		<racun_povjerioca>123-0000000000000-92</racun_povjerioca>
		<model_odobrenja>97</model_odobrenja>
		<poziv_na_broj_odobrenja>0A</poziv_na_broj_odobrenja>
	</instrument_placanja>
	<instrument_placanja xsi:type="NalogZaPrenos">
		<naziv_duznika>Jovo Jovic</naziv_duznika>
		<naziv_povjerioca>Miro Miric</naziv_povjerioca>
		<svrha_placanja>Slanje novca</svrha_placanja>
		<datum_prijema>2016-06-01</datum_prijema>
		<sifra_placanja>289</sifra_placanja>
		<valuta>RSD</valuta>
		<iznos>3000.00</iznos>
		<racun_duznika>123-0000000000000-92</racun_duznika>
		<model_zaduzenja>75</model_zaduzenja>
		<poziv_na_broj_zaduzenja>8A</poziv_na_broj_zaduzenja>
		<racun_povjerioca>123-0000000000001-89</racun_povjerioca>
		<model_odobrenja>97</model_odobrenja>
		<poziv_na_broj_odobrenja>A4</poziv_na_broj_odobrenja>
	</instrument_placanja>
	<instrument_placanja xsi:type="NalogZaIsplatu">
		<naziv_duznika>Miro Miric</naziv_duznika>
		<naziv_povjerioca>Miro Miric</naziv_povjerioca>
		<svrha_placanja>Podizanje gotovine</svrha_placanja>
		<datum_prijema>2016-06-01</datum_prijema>
		<sifra_placanja>189</sifra_placanja>
		<valuta>RSD</valuta>
		<iznos>2000.00</iznos>
		<racun_duznika>123-0000000000001-89</racun_duznika>
	</instrument_placanja>
	<instrument_placanja xsi:type="NalogZaIsplatu">
		<naziv_duznika>Miro Miric</naziv_duznika>
		<naziv_povjerioca>Miro Miric</naziv_povjerioca>
		<svrha_placanja>Podizanje gotovine</svrha_placanja>
		<datum_prijema>2016-06-01</datum_prijema>
		<sifra_placanja>189</sifra_placanja>
		<valuta>RSD</valuta>
		<iznos>2000.00</iznos>
		<racun_duznika>123-0000000000001-89</racun_duznika>
	</instrument_placanja>
</instrumenti_placanja>